{
    "name": "columnValueMinToBeBetween",
    "displayName": "ColumnValueMinToBeBetween",
    "description": "This schema defines the test ColumnValueMinToBeBetween. Test the minimum value in a col is within a range.",
    "entityType": "COLUMN",
    "testPlatforms": ["OpenMetadata", "GreatExpectations"],
    "parameterDefinition": [
      {
        "name": "minValueForMinInCol",
        "displayName": "minValueForMinInCol",
        "description": "Expected minimum value in the column to be greater or equal than",
        "dataType": "INT"
      },
      {
        "name": "maxValueForMinInCol",
        "displayName": "maxValueForMinInCol",
        "description": "Expect minimum value in the column to be lower or equal than",
        "dataType": "INT"
      }
    ]
  }
  