{
    "name": "columnValueMeanToBeBetween",
    "displayName": "columnValueMeanToBeBetween",
    "description": "This schema defines the test ColumnValueMeanToBeBetween. Test the mean value in a col is within a range.",
    "entityType": "COLUMN",
    "testPlatforms": ["OpenMetadata", "GreatExpectations"],
    "parameterDefinition": [
    {
      "name": "minValueForMeanInCol",
      "displayName": "minValueForMeanInCol",
      "description": "Expected mean value for the column to be greater or equal than",
      "dataType": "INT"
    },
    {
      "name": "maxValueForMeanInCol",
      "displayName": "maxValueForMeanInCol",
      "description": "Expected mean value for the column to be greater or equal than",
      "dataType": "INT"
    }
  ]
}
  