{
  "name": "columnValuesToNotMatchRegex",
  "displayName": "columnValuesToNotMatchRegex",
  "description": "This schema defines the test ColumnValuesToNotMatchRegex. Test the values in a column to not match a given regular expression. ",
  "entityType": "COLUMN",
  "testPlatforms": ["OpenMetadata", "GreatExpectations"],
  "parameterDefinition": [
    {
      "name": "forbiddenRegex",
      "displayName": "forbiddenRegex",
      "description": "The regular expression the column entries should not match.",
      "dataType": "STRING",
      "required": true
    }
  ]
}
