{
    "name": "columnValueMaxToBeBetween",
    "displayName": "columnValueMaxToBeBetween",
    "description": "This schema defines the test ColumnValueMaxToBeBetween. Test the maximum value in a col is within a range.",
    "entityType": "COLUMN",
    "testPlatforms": ["OpenMetadata", "GreatExpectations"],
    "parameterDefinition": [
    {
      "name": "minValueForMaxInCol",
      "displayName": "minValueForMaxInCol",
      "description": "Expected maximum value in the column to be greater or equal than",
      "dataType": "INT"
    },
    {
      "name": "maxValueForMaxInCol",
      "displayName": "maxValueForMaxInCol",
      "description": "Expected maximum value in the column to be lower or equal than",
      "dataType": "INT"
    }
  ]
}
  