{
    "name": "columnValueMedianToBeBetween",
    "displayName": "columnValueMedianToBeBetween",
    "description": "This schema defines the test ColumnValueMedianToBeBetween. Test the median value in a col is within a range.",
    "entityType": "COLUMN",
    "testPlatforms": ["OpenMetadata", "GreatExpectations"],
    "parameterDefinition": [
      {
        "name": "minValueForMedianInCol",
        "displayName": "minValueForMedianInCol",
        "description": "Expected median value for the column to be greater or equal than",
        "dataType": "INT"
      },
      {
        "name": "maxColValue",
        "displayName": "maxColValue",
        "description": "Expected median value for the column to be greater or equal than",
        "dataType": "INT"
      }
  ]
}
  