{
    "name": "columnValuesSumToBeBetween",
    "displayName": "columnValuesSumToBeBetween",
    "description": "This schema defines the test ColumnValuesSumToBeBetween. Test the sum of the values of a col is within a range.",
    "entityType": "COLUMN",
    "testPlatforms": ["OpenMetadata", "GreatExpectations"],
    "parameterDefinition": [
      {
        "name": "minValueForColSum",
        "displayName": "minValueForColSum",
        "description": "Expected sum of values in the column to be greater or equal than",
        "dataType": "INT"
      },
      {
        "name": "maxValueForColSum",
        "displayName": "maxValueForColSum",
        "description": "Expected sum values in the column to be lower or equal than",
        "dataType": "INT"
      }
    ]
  }
  