{
  "name": "columnValuesMissingCount",
  "displayName": "ColumnValuesMissingCount",
  "description": "This schema defines the test ColumnValuesMissingCount. Test the column values missing count to be equal to given number. ",
  "entityType": "COLUMN",
  "testPlatforms": ["OpenMetadata", "GreatExpectations"],
  "parameterDefinition": [
    {
      "name": "missingCountValue",
      "displayName": "missingCountValue",
      "description": "No.of missing values to be equal to.",
      "dataType": "INT",
      "required": true
    },
    {
      "name": "missingValueMatch",
      "displayName": "missingValueMatch",
      "description": "By default match all null and empty values to be missing. This field allows us to configure additional strings such as N/A, NULL as missing strings as well.",
      "dataType": "STRING"
    }
  ]
}
