{
    "name": "TableColumnNameToExist",
    "displayName": "TableColumnNameToExist",
    "description": "This test defines the test TableColumnNameToExist. Test the table columns exists in the table.",
    "entityType": "TABLE",
    "testPlatforms": ["OpenMetadata", "GreatExpectations"],
    "parameterDefinition": [
      {
        "name": "columnName",
        "displayName": "ColumnName",
        "description": "Expected column of the table to exist",
        "dataType": "STRING",
        "required": true
      }
    ]
  }
  